{
  "$schema": "https://json-schema.org/draft/2020-12/schema",
  "type": "object",
  "required": [
    "name",
    "description",
    "input_schema",
    "output_schema"
  ],
  "properties": {
    "name": {
      "type": "string"
    },
    "description": {
      "type": "string"
    },
    "input_schema": {
      "type": "object"
    },
    "output_schema": {
      "type": "object"
    }
  },
  "additionalProperties": false
}