{
  "name": "before_tool_call",
  "description": "Authorize and normalize a tool call before execution.",
  "input_schema": {
    "type": "object",
    "required": [
      "task_id",
      "payload"
    ],
    "properties": {
      "task_id": {
        "type": "string"
      },
      "payload": {
        "type": "object"
      }
    },
    "additionalProperties": false
  },
  "output_schema": {
    "type": "object",
    "required": [
      "allow",
      "payload"
    ],
    "properties": {
      "allow": {
        "type": "boolean"
      },
      "payload": {
        "type": "object"
      },
      "reason": {
        "type": "string"
      }
    },
    "additionalProperties": false
  }
}